{
  "schema_version": 1,
  "status": "DRAFT",
  "blocking": true,
  "failure_gate": "D-STATIC-INTEGRITY",
  "hooks": [
    {"id": "H-RECOMPUTE-PACKAGE-TREES", "required": true, "implementation_status": "UNIMPLEMENTED", "consumes": ["packages.json", "package source trees"], "produces": ["recomputed package byte-tree digests"]},
    {"id": "H-VERIFY-SKILL-BYTES", "required": true, "implementation_status": "UNIMPLEMENTED", "consumes": ["packages.json", "package SKILL.md bytes"], "produces": ["recomputed skill-byte digests"]},
    {"id": "H-RECOMPUTE-TARGET-TREES", "required": true, "implementation_status": "UNIMPLEMENTED", "consumes": ["targets.json", "target source trees"], "produces": ["recomputed target byte-tree digests"]},
    {"id": "H-MATERIALIZE-OPAQUE-TARGETS-AND-SCAN-LEAKAGE", "required": true, "implementation_status": "UNIMPLEMENTED", "consumes": ["target source trees", "fixture identities", "forbidden-token inventory"], "produces": ["opaque target materialization and leakage-scan receipt"]},
    {"id": "H-VALIDATE-READY-STATUS", "required": true, "implementation_status": "UNIMPLEMENTED", "consumes": ["all integrated static inputs"], "produces": ["READY-status receipt"]},
    {"id": "H-VALIDATE-CROSS-REFERENCE-CLOSURE", "required": true, "implementation_status": "UNIMPLEMENTED", "consumes": ["atom manifests", "defect rules", "authority propositions", "targets"], "produces": ["closed-reference receipt"]},
    {"id": "H-VALIDATE-HIDDEN-FIXTURE-MANIFESTS", "required": true, "implementation_status": "UNIMPLEMENTED", "consumes": ["one hidden fixture manifest per mode", "mode-launch-prompt-set.json with exact sorted 15-record prompt set per mode", "opaque target materialization", "atom and control inventories"], "produces": ["fixture closure, exact prompt-set, theorem-boundary, witness, permission, contamination, and retirement receipt"]},
    {"id": "H-VALIDATE-ORACLE-COVERAGE", "required": true, "implementation_status": "UNIMPLEMENTED", "consumes": ["atom manifests", "oracles", "allowlists", "authority propositions"], "produces": ["atom/oracle/authority coverage receipt"]},
    {"id": "H-VALIDATE-INDEPENDENT-SIGNOFFS", "required": true, "implementation_status": "UNIMPLEMENTED", "consumes": ["independent oracle-review packets", "coherence-review packet"], "produces": ["validated signoff receipt"]},
    {"id": "H-BUILD-VALIDATE-REPORT-AUTHORITY-PROJECTIONS", "required": true, "implementation_status": "UNIMPLEMENTED", "consumes": ["pinned neutral documentation bytes", "evaluator-only authority propositions", "forbidden field/token inventory"], "produces": ["content-addressed per-mode report-agent authority packets and projection/leakage receipt"]},
    {"id": "H-VALIDATE-PROMPT-RENDERINGS", "required": true, "implementation_status": "UNIMPLEMENTED", "consumes": ["condition-neutral templates", "reviewed V5/V4 invocation blocks", "no-skill zero-byte invocation", "target parameters", "agent-visible authority packet path and bytes"], "produces": ["condition byte-delta, byte-identical cross-condition authority projection, and contamination receipt"]},
    {"id": "H-FREEZE-VALIDATE-ENVELOPE-SPECS", "required": true, "implementation_status": "UNIMPLEMENTED", "consumes": ["report/scorer/consistency/adjudication output contracts", "final-response formats", "word caps", "word-counter implementation and tests"], "produces": ["READY content-addressed envelope specs"]},
    {"id": "H-FREEZE-EXECUTION-ENVIRONMENT-MANIFESTS", "required": true, "implementation_status": "UNIMPLEMENTED", "consumes": ["model and reasoning configuration", "sampling and token/time budgets", "tool/network/docs/environment policy", "comparator parity requirements"], "produces": ["content-addressed execution manifests"]},
    {"id": "H-ENFORCE-WORD-COUNTER", "required": true, "implementation_status": "UNIMPLEMENTED", "consumes": ["sealed reports", "frozen counter implementation", "mode word caps"], "produces": ["content-bound word-count results"]},
    {"id": "H-BUILD-VALIDATE-SCORER-REPORT-PROJECTIONS", "required": true, "implementation_status": "UNIMPLEMENTED", "consumes": ["raw canonical reports", "finite frozen nominal-secret inventory", "report-projection-contract.json", "GH12 rule"], "produces": ["content-bound scorer-visible report bytes", "value-free per-label leak receipts", "mechanically forced GH12 decisions"]},
    {"id": "H-GENERATE-VERIFY-RANDOMIZATION", "required": true, "implementation_status": "UNIMPLEMENTED", "consumes": ["custodied seeds", "randomization specification", "integrated identities"], "produces": ["verified schedules and blind maps"]},
    {"id": "H-VALIDATE-SCHEDULE-LEASE-ATTEMPT-LEDGER", "required": true, "implementation_status": "UNIMPLEMENTED", "consumes": ["frozen schedule", "launch records", "unique agent claims", "fresh attempt-root claims", "lease and terminal ledgers"], "produces": ["one-assigned-attempt-per-cell receipt"]},
    {"id": "H-SEMANTICALLY-REVALIDATE-ENVELOPES", "required": true, "implementation_status": "UNIMPLEMENTED", "consumes": ["canonical envelope objects", "bound launch records", "envelope specs", "failed-seal ledger"], "produces": ["full payload/metadata/format validation receipt"]},
    {"id": "H-VALIDATE-EVALUATOR-INDEPENDENCE-QUALIFICATION", "required": true, "implementation_status": "UNIMPLEMENTED", "consumes": ["scorer/consistency/novel-reviewer/adjudicator identities", "qualification and calibration records", "independence constraints"], "produces": ["evaluator assignment receipt"]},
    {"id": "H-RUN-VALIDATE-MATERIALITY-REVIEWS", "required": true, "implementation_status": "UNIMPLEMENTED", "consumes": ["materiality-review-contract.json", "complete V5 candidate/harness/protocol/adversarial packet", "two independent materiality reviews", "required disagreement adjudication"], "produces": ["complete content-bound nonempty-or-explicit-no-finding materiality ledger"]},
    {"id": "H-BUILD-WHOLE-FILE-MANIFEST", "required": true, "implementation_status": "UNIMPLEMENTED", "consumes": ["all static and generated launch inputs"], "produces": ["whole-file SHA-256 manifest"]},
    {"id": "H-CREATE-LOCK-LAST", "required": true, "implementation_status": "UNIMPLEMENTED", "consumes": ["verified whole-file manifest", "all integration receipts"], "produces": ["last-mutation lock"]},
    {"id": "H-DERIVE-AGGREGATE-CONTEXT", "required": true, "implementation_status": "UNIMPLEMENTED", "consumes": ["verified canonical envelopes", "final mode scores", "review packets", "comparison-predicate.json", "aggregation-rules.json"], "produces": ["deterministically derived gate context"]},
    {"id": "H-VALIDATE-AGGREGATION-RULE-INVENTORY", "required": true, "implementation_status": "UNIMPLEMENTED", "consumes": ["aggregation-rules.json", "gate-manifest.json", "versioned final-score/control/oracle/envelope schemas"], "produces": ["one-to-one context-source and deterministic-formula coverage receipt"]},
    {"id": "H-BIND-CONTEXT-INPUT-DIGESTS", "required": true, "implementation_status": "UNIMPLEMENTED", "consumes": ["derived gate context", "sealed input/output digests"], "produces": ["content-bound aggregate receipt"]}
  ]
}
